{
  "code_version": "the-pass-0.4.0-b2",
  "command": "the-pass backtest baseline --strategy prediction_market_complement_or_fair_value_v1",
  "config_hash": "e7f5d388ab9d1f8fa10487907e66262beb6dceffcdf312d0b54367b23aa44c41",
  "created_at": "2026-07-10T00:00:00Z",
  "data_manifest": "data_manifest.json",
  "id": "prediction_market_complement_or_fair_value_v1-run",
  "inputs": {
    "dataset_fingerprint": "9e0399f7a3ae31bda94eefaa889ccf1f0f460d68236944bb6a74fc0fb27e0686",
    "search_space": "search_space.json"
  },
  "notes": "Deterministic public synthetic B2 baseline.",
  "outputs": {
    "cost_waterfall": "cost_waterfall.json",
    "html_report": "run_report.html",
    "markdown_report": "run_report.md",
    "metrics_report": "metrics_report.json",
    "quality_report": "quality_report.json",
    "screen_results": "screen_results.json",
    "verdict_report": "verdict_report.json"
  },
  "owner": "strategy_implementer",
  "random_seed": null,
  "safety": {
    "credentials_available": false,
    "live_trading_enabled": false,
    "real_order_path_available": false
  },
  "schema_version": 2,
  "strategy_spec": "strategy_spec.json"
}
