{
  "code_version": "the-pass-0.4.0-b2",
  "command": "the-pass backtest baseline --name futures_diversified_trend_v1",
  "config_hash": "e2b08980fe2a62c4c85a1cca3e76fd6e9caea64ce5e8a195882dfb9323843179",
  "created_at": "2026-07-10T00:00:00Z",
  "data_manifest": "data_manifest.json",
  "id": "futures_diversified_trend_v1-run",
  "inputs": {
    "dataset_fingerprint": "00db3c45989ad1dab8285f1c8745e1d779c1df148ce13dc66343f49be214e42d",
    "search_space": "search_space.json"
  },
  "notes": "Deterministic public synthetic B2 baseline.",
  "outputs": {
    "cost_waterfall": "cost_waterfall.json",
    "html_report": "run_report.html",
    "markdown_report": "run_report.md",
    "metrics_report": "metrics_report.json",
    "quality_report": "quality_report.json",
    "screen_results": "screen_results.json",
    "verdict_report": "verdict_report.json"
  },
  "owner": "strategy_implementer",
  "random_seed": null,
  "safety": {
    "credentials_available": false,
    "live_trading_enabled": false,
    "real_order_path_available": false
  },
  "schema_version": 2,
  "strategy_spec": "strategy_spec.json"
}
