{
  "code_version": "the-pass-0.4.0-b2",
  "command": "the-pass backtest baseline --name null_random_control_v1",
  "config_hash": "182ca6e190f0a6ffdecaeee0da708affcbd1e6383b218a7d17f0802dfc0b2a3d",
  "created_at": "2026-07-10T00:00:00Z",
  "data_manifest": "data_manifest.json",
  "id": "null_random_control_v1-run",
  "inputs": {
    "dataset_fingerprint": "54e0047b86e36e7782020f1491262c8fbb4bf07834ff0f41fa87c3d037db7237",
    "search_space": "search_space.json"
  },
  "notes": "Deterministic public synthetic B2 baseline.",
  "outputs": {
    "cost_waterfall": "cost_waterfall.json",
    "html_report": "run_report.html",
    "markdown_report": "run_report.md",
    "metrics_report": "metrics_report.json",
    "quality_report": "quality_report.json",
    "screen_results": "screen_results.json",
    "verdict_report": "verdict_report.json"
  },
  "owner": "strategy_implementer",
  "random_seed": 7,
  "safety": {
    "credentials_available": false,
    "live_trading_enabled": false,
    "real_order_path_available": false
  },
  "schema_version": 2,
  "strategy_spec": "strategy_spec.json"
}
