{
  "code_version": "the-pass-0.4.0-b2",
  "command": "the-pass backtest baseline --strategy crypto_spot_buy_hold_benchmark_v1",
  "config_hash": "6398fbd4b18831accf795658a8632aebafbd48d2de191eb08d752b0b09bd79f5",
  "created_at": "2026-07-10T00:00:00Z",
  "data_manifest": "data_manifest.json",
  "id": "crypto_spot_buy_hold_benchmark_v1-run",
  "inputs": {
    "dataset_fingerprint": "e22d47a0b450f3413548fe89e704e0550de00d579276d1c804b26f4e8bf37d39",
    "search_space": "search_space.json"
  },
  "notes": "Deterministic public synthetic B2 baseline.",
  "outputs": {
    "cost_waterfall": "cost_waterfall.json",
    "html_report": "run_report.html",
    "markdown_report": "run_report.md",
    "metrics_report": "metrics_report.json",
    "quality_report": "quality_report.json",
    "screen_results": "screen_results.json",
    "verdict_report": "verdict_report.json"
  },
  "owner": "strategy_implementer",
  "random_seed": null,
  "safety": {
    "credentials_available": false,
    "live_trading_enabled": false,
    "real_order_path_available": false
  },
  "schema_version": 2,
  "strategy_spec": "strategy_spec.json"
}
